{
  "$schema": "./capability-registry.v1.schema.json",
  "schema_version": "1.0.0",
  "registry_id": "hub_optimus.public_capabilities.v1",
  "registry_mode": "human-reviewed-static",
  "reviewed_at": "2026-09-30",
  "baseline": {
    "canonical_repository": "Voxterrae/HUB_Optimus",
    "source_baseline_sha": "30e985226347b4bc59b0e187b96633a09647ca42",
    "public_evidence_sha": "8426b08e5f88b650c4d79e41d3ce3afd7d42746b",
    "github_pages": {
      "observed_at": "2026-08-16",
      "public_url": "https://huboptimus.dev/",
      "workflow_path": ".github/workflows/pages.yml",
      "artifact_path": "site",
      "observed_run_id": 31957372253,
      "observed_source_sha": "30e985226347b4bc59b0e187b96633a09647ca42",
      "observed_conclusion": "success",
      "portfolio_generation": "manual",
      "merge_path_triggers_pages": true
    },
    "sites_mirror": {
      "observed_at": "2026-07-30",
      "authoritative": false,
      "visibility": "owner-only",
      "synchronization": "manual-deterministic",
      "observed_version": 8,
      "observed_source_sha": "b64203fc8c784fd50053872767b179d97f451cc1",
      "matches_source_baseline": false,
      "tracking_issue": "https://github.com/Voxterrae/HUB_Optimus/issues/1809"
    }
  },
  "components": [
    {
      "id": "core",
      "display_name": "HUB_Optimus Core",
      "lifecycle_state": "active-methodology",
      "source_status": "merged",
      "public_section": "what-exists-today",
      "publicly_listed": true,
      "public_static_surface_available": true,
      "public_browser_runtime_available": false,
      "production_service_deployed": false,
      "production_writes_executed": 0,
      "live_external_transport_enabled": false,
      "evidence": [
        {
          "type": "commit-path",
          "ref": "8426b08e5f88b650c4d79e41d3ce3afd7d42746b",
          "url": "https://github.com/Voxterrae/HUB_Optimus/tree/8426b08e5f88b650c4d79e41d3ce3afd7d42746b/v1_core/languages/es"
        }
      ],
      "claim_boundary": "Versioned methodology and workflow; not a deployed autonomous authority or decision maker."
    },
    {
      "id": "simulator",
      "display_name": "Deterministic Scenario Simulator",
      "lifecycle_state": "working-deterministic-prototype",
      "source_status": "merged",
      "public_section": "what-exists-today",
      "publicly_listed": true,
      "public_static_surface_available": true,
      "public_browser_runtime_available": false,
      "production_service_deployed": false,
      "production_writes_executed": 0,
      "live_external_transport_enabled": false,
      "evidence": [
        {
          "type": "commit-path",
          "ref": "8426b08e5f88b650c4d79e41d3ce3afd7d42746b",
          "url": "https://github.com/Voxterrae/HUB_Optimus/blob/8426b08e5f88b650c4d79e41d3ce3afd7d42746b/SIMULATION_README.md"
        }
      ],
      "claim_boundary": "Deterministic repository prototype; no claim of live institutional or production execution."
    },
    {
      "id": "semantic-engine",
      "display_name": "Semantic Engine Contracts and CLI",
      "lifecycle_state": "early-implementation",
      "source_status": "merged",
      "public_section": "what-exists-today",
      "publicly_listed": true,
      "public_static_surface_available": true,
      "public_browser_runtime_available": false,
      "production_service_deployed": false,
      "production_writes_executed": 0,
      "live_external_transport_enabled": false,
      "evidence": [
        {
          "type": "commit-path",
          "ref": "8426b08e5f88b650c4d79e41d3ce3afd7d42746b",
          "url": "https://github.com/Voxterrae/HUB_Optimus/tree/8426b08e5f88b650c4d79e41d3ce3afd7d42746b/semantic_engine"
        }
      ],
      "claim_boundary": "Local contracts and CLI; it does not establish a public hosted engine or verify truth."
    },
    {
      "id": "operator",
      "display_name": "HUB_Optimus Operator",
      "lifecycle_state": "browser-prototype",
      "source_status": "merged",
      "public_section": "what-exists-today",
      "publicly_listed": true,
      "public_static_surface_available": true,
      "public_browser_runtime_available": true,
      "production_service_deployed": false,
      "production_writes_executed": 0,
      "live_external_transport_enabled": false,
      "evidence": [
        {
          "type": "commit-path",
          "ref": "8426b08e5f88b650c4d79e41d3ce3afd7d42746b",
          "url": "https://github.com/Voxterrae/HUB_Optimus/tree/8426b08e5f88b650c4d79e41d3ce3afd7d42746b/site/operator"
        }
      ],
      "claim_boundary": "Public browser-side prototype; local drafts are not verified evidence and no private runtime is implied."
    },
    {
      "id": "controlled-url-intake",
      "display_name": "Controlled URL Intake",
      "lifecycle_state": "implementation-present-deployment-unverified",
      "source_status": "merged",
      "public_section": "what-exists-today",
      "publicly_listed": true,
      "public_static_surface_available": true,
      "public_browser_runtime_available": false,
      "production_service_deployed": false,
      "production_writes_executed": 0,
      "live_external_transport_enabled": false,
      "evidence": [
        {
          "type": "commit-path",
          "ref": "8426b08e5f88b650c4d79e41d3ce3afd7d42746b",
          "url": "https://github.com/Voxterrae/HUB_Optimus/blob/8426b08e5f88b650c4d79e41d3ce3afd7d42746b/docs/rfc/operator_controlled_url_intake.md"
        }
      ],
      "claim_boundary": "Repository implementation and tests exist; no public authenticated URL-retrieval service is established."
    },
    {
      "id": "research",
      "display_name": "Scenario and Narrative Research",
      "lifecycle_state": "experimental-tooling",
      "source_status": "merged",
      "public_section": "what-exists-today",
      "publicly_listed": true,
      "public_static_surface_available": true,
      "public_browser_runtime_available": false,
      "production_service_deployed": false,
      "production_writes_executed": 0,
      "live_external_transport_enabled": false,
      "evidence": [
        {
          "type": "commit-path",
          "ref": "8426b08e5f88b650c4d79e41d3ce3afd7d42746b",
          "url": "https://github.com/Voxterrae/HUB_Optimus/blob/8426b08e5f88b650c4d79e41d3ce3afd7d42746b/docs/lab_state.md"
        }
      ],
      "claim_boundary": "Experimental repository tooling; not a promoted benchmark, production service or autonomous research authority."
    },
    {
      "id": "governance-intelligence",
      "display_name": "Governance Intelligence",
      "lifecycle_state": "active-ratified-protocol",
      "source_status": "merged",
      "public_section": "what-exists-today",
      "publicly_listed": true,
      "public_static_surface_available": true,
      "public_browser_runtime_available": false,
      "production_service_deployed": false,
      "production_writes_executed": 0,
      "live_external_transport_enabled": false,
      "evidence": [
        {
          "type": "commit-path",
          "ref": "8426b08e5f88b650c4d79e41d3ce3afd7d42746b",
          "url": "https://github.com/Voxterrae/HUB_Optimus/blob/8426b08e5f88b650c4d79e41d3ce3afd7d42746b/docs/governance/GOVERNANCE_INTELLIGENCE.md"
        }
      ],
      "claim_boundary": "Versioned human-governance protocol; it does not create automatic legal, political or technical authority."
    },
    {
      "id": "labs",
      "display_name": "HUB-Optimus Labs",
      "lifecycle_state": "documented-incubation-surface",
      "source_status": "merged",
      "public_section": "what-exists-today",
      "publicly_listed": true,
      "public_static_surface_available": true,
      "public_browser_runtime_available": false,
      "production_service_deployed": false,
      "production_writes_executed": 0,
      "live_external_transport_enabled": false,
      "evidence": [
        {
          "type": "commit-path",
          "ref": "8426b08e5f88b650c4d79e41d3ce3afd7d42746b",
          "url": "https://github.com/Voxterrae/HUB_Optimus/blob/8426b08e5f88b650c4d79e41d3ce3afd7d42746b/site/index.html"
        }
      ],
      "claim_boundary": "The pinned HUB_Optimus portfolio documents a public Labs incubation reference. This registry does not certify the current contents or emptiness of the separate Labs repository; its mutable external state remains unverified."
    },
    {
      "id": "admin-gateway",
      "display_name": "Optimus Admin Gateway",
      "lifecycle_state": "implementation-present-deployment-unverified",
      "source_status": "merged",
      "public_section": "in-development",
      "publicly_listed": false,
      "public_static_surface_available": false,
      "public_browser_runtime_available": false,
      "production_service_deployed": false,
      "production_writes_executed": 0,
      "live_external_transport_enabled": false,
      "evidence": [
        {
          "type": "commit-path",
          "ref": "c7a67a7af9e5067e27518d3a9bd8b56f99767acf",
          "url": "https://github.com/Voxterrae/HUB_Optimus/tree/c7a67a7af9e5067e27518d3a9bd8b56f99767acf/products/admin-gateway/src/optimus_admin_gateway"
        },
        {
          "type": "commit-path",
          "ref": "fc5e45d35376184609341ec1b1232ca381c89993",
          "url": "https://github.com/Voxterrae/HUB_Optimus/tree/fc5e45d35376184609341ec1b1232ca381c89993/products/admin-gateway/runbooks"
        },
        {
          "type": "commit-path",
          "ref": "77ec62b023ee128d3c84b68e38423d9def6a4c44",
          "url": "https://github.com/Voxterrae/HUB_Optimus/tree/77ec62b023ee128d3c84b68e38423d9def6a4c44/products/admin-gateway/power-platform/custom-connector"
        },
        {
          "type": "commit-path",
          "ref": "d12f96f43f2e09ba911f371bdc2f3708413e7043",
          "url": "https://github.com/Voxterrae/HUB_Optimus/tree/d12f96f43f2e09ba911f371bdc2f3708413e7043/products/admin-gateway/dataverse"
        },